<!ELEMENT Albumes (Album*)>
<!ELEMENT Album (ID, Foto)*>
<!ELEMENT Foto (place, date, camera, people, modelo)>
<!ELEMENT ID (#PCDATA)>
<!ELEMENT place (#PCDATA)>
<!ELEMENT date (#PCDATA)>
<!ELEMENT camera (#PCDATA)>
<!ELEMENT people (#PCDATA)>
<!ELEMENT modelo (#PCDATA)>